{
  "matrix_version": "v1",
  "generated_at": "2026-06-20T12:00:00Z",
  "details_redacted": true,
  "services": [
    {
      "service_id": "df-local-foundation",
      "service_class": "substrate",
      "state": "ready",
      "readiness_class": "ready",
      "observation": "observed",
      "summary": "DF Local Foundation is ready.",
      "last_updated_at": "2026-06-20T11:59:50Z"
    },
    {
      "service_id": "neuronforge-local",
      "service_class": "inference",
      "state": "degraded",
      "degraded_subtype": "degraded_fallback_limited",
      "readiness_class": "ready_with_constraints",
      "observation": "observed",
      "summary": "NeuronForge Local serving on a limited fallback lane.",
      "last_updated_at": "2026-06-20T11:59:55Z"
    },
    {
      "service_id": "cortex",
      "service_class": "file_intelligence",
      "state": "ready",
      "readiness_class": "ready",
      "observation": "observed",
      "last_updated_at": "2026-06-20T11:59:58Z"
    },
    {
      "service_id": "fa-local",
      "service_class": "execution",
      "state": "unavailable",
      "readiness_class": "not_ready",
      "blocking_reasons": ["dependency_unavailable"],
      "observation": "missing",
      "summary": "No status reported; treated as unavailable (fail-closed).",
      "last_updated_at": "2026-06-20T12:00:00Z"
    }
  ]
}
